{
  "schema_version": 1,
  "event_id": "dcs-server-alpha:run-20260830T120000Z-a1b2c3:4",
  "source": "moose-mission",
  "producer_id": "dcs-server-alpha",
  "source_version": "duel-dynamic-telemetry-v1",
  "run_key": "run-20260830T120000Z-a1b2c3",
  "event_sequence": 4,
  "event_type": "asset.crashed",
  "sim_time": 310.25,
  "wall_time": null,
  "initiator": null,
  "target": null,
  "participant": {
    "status": "known",
    "kind": "participant",
    "participant_id": "ucid-0123456789abcdef",
    "display_name": "Viper",
    "callsign": "Aerial 1-1",
    "coalition": "blue"
  },
  "asset": {
    "status": "known",
    "kind": "aircraft",
    "asset_key": "aerial-1.1",
    "dcs_name": "Aerial-1-1",
    "dcs_type": "FA-18C_hornet",
    "coalition": "blue"
  },
  "weapon": null,
  "coalition": "blue",
  "location": {
    "status": "known",
    "coordinate_system": "dcs-local",
    "x": 130200,
    "y": 12.5,
    "z": -40100
  },
  "payload": {
    "dcs_event_name": "crash"
  }
}
